{"canonical_hash":"sha256:e47e53d31d11d96ff85258e9016284696c6176493483ad064f85c0447dc9ed1b","expected_first_violation":{"event_id":"event.desktop-stale-snapshot.002","event_kind":"snapshot","expected_transitions":[],"fault_model_transitions":["OFFLINE"],"invariant_id":"BRIDGE.STALE_SNAPSHOT_IS_NO_OP","sequence_id":2,"trace_index":1},"fault_class":"stale-snapshot","initial_state":{"snapshot":{"brainState":"READY","bridgeRevision":10,"lifecycle":"READY","microphoneState":"ENABLED","presence":{"reason":"trace-minimizer","revision":4,"state":"IDLE"}}},"minimal_trace":{"event_ids":["event.desktop-stale-snapshot.002"]},"minimization":{"minimal_event_count":1,"original_event_count":3,"source_event_indices":[2],"source_scenario":"stale-offline-snapshot-with-noise"},"name":"desktop-stale-snapshot","schema_version":"2.0","seed":{"events":[{"event_id":"event.desktop-stale-snapshot.001","kind":"snapshot","payload":{"brainState":"READY","bridgeRevision":10,"lifecycle":"READY","microphoneState":"ENABLED","presence":{"reason":"trace-minimizer","revision":4,"state":"IDLE"}},"sequence_id":1},{"event_id":"event.desktop-stale-snapshot.002","kind":"snapshot","payload":{"brainState":"READY","bridgeRevision":9,"lifecycle":"DEGRADED","microphoneState":"UNAVAILABLE","presence":{"reason":"trace-minimizer","revision":4,"state":"OFFLINE"}},"sequence_id":2},{"event_id":"event.desktop-stale-snapshot.003","kind":"snapshot","payload":{"brainState":"READY","bridgeRevision":10,"lifecycle":"READY","microphoneState":"ENABLED","presence":{"reason":"trace-minimizer","revision":4,"state":"IDLE"}},"sequence_id":3}],"seed_id":"seed.desktop-stale-snapshot.v1"},"system":"desktop-runtime-bridge"}
