{"canonical_hash":"sha256:0ecac355116574fa3026df3c00506f683a0f92c7038e8f3452a7d46873695fb6","expected_first_violation":{"event_id":"event.desktop-duplicate-revision-conflict.003","event_kind":"snapshot","expected_transitions":[],"fault_model_transitions":["OFFLINE"],"invariant_id":"BRIDGE.SAME_REVISION_CONFLICT_IS_NO_OP","sequence_id":3,"trace_index":1},"fault_class":"duplicate","initial_state":{"snapshot":{"brainState":"READY","bridgeRevision":10,"lifecycle":"READY","microphoneState":"ENABLED","presence":{"reason":"trace-minimizer","revision":4,"state":"IDLE"}}},"minimal_trace":{"event_ids":["event.desktop-duplicate-revision-conflict.003"]},"minimization":{"minimal_event_count":1,"original_event_count":4,"source_event_indices":[3],"source_scenario":"duplicate-conflicting-same-revision-with-noise"},"name":"desktop-duplicate-revision-conflict","schema_version":"2.0","seed":{"events":[{"event_id":"event.desktop-duplicate-revision-conflict.001","kind":"snapshot","payload":{"brainState":"READY","bridgeRevision":9,"lifecycle":"DEGRADED","microphoneState":"UNAVAILABLE","presence":{"reason":"trace-minimizer","revision":4,"state":"OFFLINE"}},"sequence_id":1},{"event_id":"event.desktop-duplicate-revision-conflict.002","kind":"snapshot","payload":{"brainState":"READY","bridgeRevision":10,"lifecycle":"READY","microphoneState":"ENABLED","presence":{"reason":"trace-minimizer","revision":4,"state":"IDLE"}},"sequence_id":2},{"event_id":"event.desktop-duplicate-revision-conflict.003","kind":"snapshot","payload":{"brainState":"READY","bridgeRevision":10,"lifecycle":"DEGRADED","microphoneState":"UNAVAILABLE","presence":{"reason":"trace-minimizer","revision":4,"state":"OFFLINE"}},"sequence_id":3},{"event_id":"event.desktop-duplicate-revision-conflict.004","kind":"snapshot","payload":{"brainState":"READY","bridgeRevision":11,"lifecycle":"READY","microphoneState":"ENABLED","presence":{"reason":"trace-minimizer","revision":5,"state":"IDLE"}},"sequence_id":4}],"seed_id":"seed.desktop-duplicate-revision-conflict.v1"},"system":"desktop-runtime-bridge"}
