{"canonical_hash":"sha256:eeb76545885ed482a0d62d39c14eb7d4a179a33a8f4a5bf635fd7d82f3528bdb","expected_first_violation":{"event_id":"event.desktop-reconnect-race.002","event_kind":"connected","expected_transitions":[],"fault_model_transitions":["CONNECTING","READY"],"invariant_id":"BRIDGE.LATE_CONNECTED_HAS_NO_TRANSIENT_UI","sequence_id":2,"trace_index":1},"fault_class":"reconnect-race","initial_state":{"snapshot":{"brainState":"READY","bridgeRevision":10,"lifecycle":"READY","microphoneState":"ENABLED","presence":{"reason":"trace-minimizer","revision":4,"state":"IDLE"}}},"minimal_trace":{"event_ids":["event.desktop-reconnect-race.002"]},"minimization":{"minimal_event_count":1,"original_event_count":3,"source_event_indices":[2],"source_scenario":"late-connected-after-ready-with-noise"},"name":"desktop-reconnect-race","schema_version":"2.0","seed":{"events":[{"event_id":"event.desktop-reconnect-race.001","kind":"snapshot","payload":{"brainState":"READY","bridgeRevision":10,"lifecycle":"READY","microphoneState":"ENABLED","presence":{"reason":"trace-minimizer","revision":4,"state":"IDLE"}},"sequence_id":1},{"event_id":"event.desktop-reconnect-race.002","kind":"connected","sequence_id":2,"snapshot_response":{"brainState":"READY","bridgeRevision":10,"lifecycle":"READY","microphoneState":"ENABLED","presence":{"reason":"trace-minimizer","revision":4,"state":"IDLE"}}},{"event_id":"event.desktop-reconnect-race.003","kind":"snapshot","payload":{"brainState":"READY","bridgeRevision":10,"lifecycle":"READY","microphoneState":"ENABLED","presence":{"reason":"trace-minimizer","revision":4,"state":"IDLE"}},"sequence_id":3}],"seed_id":"seed.desktop-reconnect-race.v1"},"system":"desktop-runtime-bridge"}
