{"canonical_hash":"sha256:7c6d3cd757551634d6efb92ef18f2c2387d77e4181662850a24cee4f3089bcdd","expected_first_violation":{"event_id":"event.desktop-out-of-order-snapshot.004","event_kind":"snapshot","expected_transitions":[],"fault_model_transitions":["OFFLINE"],"invariant_id":"BRIDGE.OUT_OF_ORDER_SNAPSHOT_IS_NO_OP","sequence_id":4,"trace_index":2},"fault_class":"out-of-order","initial_state":{"snapshot":{"brainState":"READY","bridgeRevision":10,"lifecycle":"READY","microphoneState":"ENABLED","presence":{"reason":"trace-minimizer","revision":4,"state":"IDLE"}}},"minimal_trace":{"event_ids":["event.desktop-out-of-order-snapshot.002","event.desktop-out-of-order-snapshot.004"]},"minimization":{"minimal_event_count":2,"original_event_count":4,"source_event_indices":[2,4],"source_scenario":"newer-then-out-of-order-snapshot-with-noise"},"name":"desktop-out-of-order-snapshot","schema_version":"2.0","seed":{"events":[{"event_id":"event.desktop-out-of-order-snapshot.001","kind":"snapshot","payload":{"brainState":"READY","bridgeRevision":10,"lifecycle":"READY","microphoneState":"ENABLED","presence":{"reason":"trace-minimizer","revision":4,"state":"IDLE"}},"sequence_id":1},{"event_id":"event.desktop-out-of-order-snapshot.002","kind":"snapshot","payload":{"brainState":"READY","bridgeRevision":12,"lifecycle":"READY","microphoneState":"ENABLED","presence":{"reason":"trace-minimizer","revision":5,"state":"IDLE"}},"sequence_id":2},{"event_id":"event.desktop-out-of-order-snapshot.003","kind":"snapshot","payload":{"brainState":"READY","bridgeRevision":12,"lifecycle":"READY","microphoneState":"ENABLED","presence":{"reason":"trace-minimizer","revision":5,"state":"IDLE"}},"sequence_id":3},{"event_id":"event.desktop-out-of-order-snapshot.004","kind":"snapshot","payload":{"brainState":"READY","bridgeRevision":11,"lifecycle":"DEGRADED","microphoneState":"UNAVAILABLE","presence":{"reason":"trace-minimizer","revision":4,"state":"OFFLINE"}},"sequence_id":4}],"seed_id":"seed.desktop-out-of-order-snapshot.v1"},"system":"desktop-runtime-bridge"}
